,Q,A
1466,서울 동작구 상도동,"병원명은 한빛연세내과의원 주소는 서울특별시 동작구 성대로 11, 2층 (상도동) 전화번호는 02-826-7582 입니다."
1467,서울 동작구 신대방동,"병원명은 한사랑의원 주소는 서울특별시 동작구 여의대방로24길 30, 2층 (신대방동, 한사랑의원) 전화번호는 02-823-9700 입니다."
1468,서울 동작구 상도동,"병원명은 한양재활의학과의원 주소는 서울특별시 동작구 상도로 234, 2층 (상도동) 전화번호는 02-817-8131 입니다."
1469,서울 동작구 신대방동,"병원명은 함소아한의원 주소는 서울특별시 동작구 신대방1가길 38, 105동 205,206호 (신대방동, 성원상떼빌) 전화번호는 02-836-1065 입니다."
1470,서울 동작구 상도동,"병원명은 행복한아침내과의원 주소는 서울특별시 동작구 양녕로 184-1, (상도동) 전화번호는 정보없음 입니다."
1471,서울 동작구 본동,"병원명은 현성의원 주소는 서울특별시 동작구 매봉로 182, 6층 (본동) 전화번호는 02-821-0075 입니다."
1472,서울 동작구 노량진동,"병원명은 형운준소아청소년과의원 주소는 서울특별시 동작구 장승배기로 119, 2층 (노량진동) 전화번호는 02-826-1661 입니다."
1473,서울 동작구 사당동,"병원명은 홍소아청소년과의원 주소는 서울특별시 동작구 동작대로29길 69, 302호 (사당동) 전화번호는 02-535-1007 입니다."
1474,서울 마포구 도화동,"병원명은 가든이비인후과의원 주소는 서울특별시 마포구 마포대로 52, 201호 (도화동, 고려아카데미텔Ⅱ) 전화번호는 정보없음 입니다."
1475,서울 마포구 망원동,"병원명은 강가정의학과의원 주소는 서울특별시 마포구 방울내로 70, 2층 (망원동) 전화번호는 02-337-8645 입니다."
1476,서울 마포구 염리동,"병원명은 건강한내과의원 주소는 서울특별시 마포구 큰우물로 53, 마포 네이버타운 2층 201(일부),202호 (염리동) 전화번호는 02-2088-6119 입니다."
1477,서울 마포구 합정동,"병원명은 고려가정의학과의원 주소는 서울특별시 마포구 독막로 10, 3층 (합정동) 전화번호는 정보없음 입니다."
1478,서울 마포구 동교동,"병원명은 고려정형외과의원 주소는 서울특별시 마포구 신촌로 12, 5층 (동교동) 전화번호는 02-337-2221 입니다."
1479,서울 마포구 신공덕동,"병원명은 공덕365의원 주소는 서울특별시 마포구 백범로 199, 메트로디오빌빌딩 2층 201B,202호 (신공덕동) 전화번호는 02-714-0365 입니다."
1480,서울 마포구 아현동,"병원명은 공덕아산내과의원 주소는 서울특별시 마포구 마포대로 204, 마포에스케이허브블루 203,204호 (아현동) 전화번호는 02-393-7582 입니다."
1481,서울 마포구 도화동,"병원명은 공덕연세이비인후과의원 주소는 서울특별시 마포구 마포대로 92, 효성해링턴 스퀘어 B동 5층 4호 (도화동) 전화번호는 02-2197-1707 입니다."
1482,서울 마포구 아현동,"병원명은 권이비인후과의원 주소는 서울특별시 마포구 신촌로 266-1, 5층 (아현동) 전화번호는 02-362-0660 입니다."
1483,서울 마포구 노고산동,"병원명은 김성전·김시찬이비인후과의원 주소는 서울특별시 마포구 신촌로 92, 신촌카리스빌딩 2,3층 (노고산동) 전화번호는 02-324-9127 입니다."
1484,서울 마포구 공덕동,"병원명은 김이비인후과의원 주소는 서울특별시 마포구 만리재로 15, 303호 (공덕동, 제일빌딩) 전화번호는 02-702-2004 입니다."
1485,서울 마포구 염리동,"병원명은 김재학내과의원 주소는 서울특별시 마포구 큰우물로 53, 402호 (염리동) 전화번호는 02-704-1335 입니다."
1486,서울 마포구 망원동,"병원명은 김진의원 주소는 서울특별시 마포구 망원로 78, (망원동) 전화번호는 02-333-2967 입니다."
1487,서울 마포구 공덕동,"병원명은 꿈나무소아청소년과의원 주소는 서울특별시 마포구 마포대로 143, 226호 (공덕동, 마포공덕파크팰리스2) 전화번호는 02-715-6215 입니다."
1488,서울 마포구 대흥동,"병원명은 남산의원 주소는 서울특별시 마포구 대흥로 169-0, 201호 (대흥동, 베스텔) 전화번호는 02-715-6951 입니다."
1489,서울 마포구 도화동,"병원명은 내안애내과의원 주소는 서울특별시 마포구 마포대로 68, 604~607호 (도화동, 마포아크로타워) 전화번호는 02-712-4800 입니다."
1490,서울 마포구 상암동,"병원명은 누리꿈이비인후과의원 주소는 서울특별시 마포구 월드컵북로 396, 지하1층 1071호 (상암동, 누리꿈스퀘어) 전화번호는 02-2132-8060 입니다."
1491,서울 마포구 대흥동,"병원명은 뉴센스의원 주소는 서울특별시 마포구 신촌로 170, 상가306,307호 (대흥동, 이대역푸르지오시티) 전화번호는 02-3272-8885 입니다."
1492,서울 마포구 염리동,"병원명은 다나이비인후과의원 주소는 서울특별시 마포구 큰우물로 53, 302호 (염리동) 전화번호는 02-702-5075 입니다."
1493,서울 마포구 도화동,"병원명은 다웰내과의원 주소는 서울특별시 마포구 큰우물로 76, 고려빌딩 1,2층 103호,201호 (도화동) 전화번호는 02-322-5225 입니다."
1494,서울 마포구 동교동,"병원명은 닥터윤이비인후과의원 주소는 서울특별시 마포구 동교로 207, 3층 (동교동) 전화번호는 02-335-3365 입니다."
1495,서울 마포구 상암동,"병원명은 닥터척척의원 주소는 서울특별시 마포구 월드컵북로 402, 케이지아이티센터 2층 211,213호 (상암동) 전화번호는 02-6393-5771 입니다."
1496,서울 마포구 망원동,"병원명은 닥터훈소아청소년과의원 주소는 서울특별시 마포구 월드컵로13길 79, 104호 (망원동, 해오름주상복합) 전화번호는 02-324-1119 입니다."
1497,서울 마포구 망원동,"병원명은 더건강내과의원 주소는 서울특별시 마포구 월드컵로13길 34, 3층 (망원동, 두드림빌딩) 전화번호는 02-338-8275 입니다."
1498,서울 마포구 도화동,"병원명은 더튼튼소아청소년과의원 주소는 서울특별시 마포구 마포대로 68, 404, 408-1호 (도화동, 마포아크로타워) 전화번호는 02-704-7575 입니다."
1499,서울 마포구 망원동,"병원명은 드림이비인후과의원 주소는 서울특별시 마포구 월드컵로 79, 3층 (망원동, 유용빌딩) 전화번호는 02-338-5050 입니다."
1500,서울 마포구 상암동,"병원명은 디엠씨연세의원 주소는 서울특별시 마포구 월드컵북로 361, 307호 (상암동, DMC이안상암2단지) 전화번호는 02-6393-0508 입니다."
1501,서울 마포구 일부,"병원명은 랩이비인후과의원 주소는 서울특별시 마포구 양화로 61, 두암빌딩 1(일부)2(일부)층 (서교동) 전화번호는 02-6015-5075 입니다."
1502,서울 마포구 상암동,"병원명은 리드힐정형외과의원 주소는 서울특별시 마포구 월드컵북로 361, 2층 205~218,226호 (상암동, DMC이안2단지 ) 전화번호는 02-6393-0888 입니다."
1503,서울 마포구 공덕동,"병원명은 리앤미가정의학과의원 주소는 서울특별시 마포구 마포대로 115-12, 상가동 201,202,204,205호 (공덕동, 공덕삼성아파트) 전화번호는 02-712-3035 입니다."
1504,서울 마포구 대흥동,"병원명은 마리이비인후과의원 주소는 서울특별시 마포구 백범로 96, 2층 (대흥동) 전화번호는 02-715-3239 입니다."
1505,서울 마포구 염리동,"병원명은 마포늘푸른의원 주소는 서울특별시 마포구 대흥로24길 24, 마포프레스티지자이 상가A동 2층 208~209호 (염리동) 전화번호는 02-717-7553 입니다."
1506,서울 마포구 공덕동,"병원명은 마포마취통증의학과의원 주소는 서울특별시 마포구 만리재로 15, 408호 (공덕동, 제일빌딩) 전화번호는 02-707-3438 입니다."
1507,서울 마포구 서교동,"병원명은 마포의료복지사회적협동조합 무지개의원 주소는 서울특별시 마포구 월드컵로 80, 7층 (서교동, 아침뜨락빌딩) 전화번호는 02-326-0611 입니다."
1508,서울 마포구 상암동,"병원명은 맑은성모이비인후과의원 주소는 서울특별시 마포구 월드컵북로 402, 케이지아이티센터 316,317호 (상암동) 전화번호는 02-6393-5561 입니다."
1509,서울 마포구 서교동,"병원명은 메디람한방병원 주소는 서울특별시 마포구 양화로 119, 디키즈코리아 B1~6층 (서교동) 전화번호는 02-333-3300 입니다."
1510,서울 마포구 서교동,"병원명은 메세나연세소아청소년과의원 주소는 서울특별시 마포구 양화로 45, 지하2층 (서교동, 메세나폴리스) 전화번호는 02-335-1164 입니다."
1511,서울 마포구 중동,"병원명은 박병권내과의원 주소는 서울특별시 마포구 월드컵북로 230, 3층 3호 (중동, 현대상가) 전화번호는 02-306-5533 입니다."
1512,서울 마포구 망원동,"병원명은 박성호한의원 주소는 서울특별시 마포구 월드컵로 125, 205호 (망원동, 영보빌딩) 전화번호는 02-322-6094 입니다."
1513,서울 마포구 망원동,"병원명은 박영준내과의원 주소는 서울특별시 마포구 월드컵로 155, 2층 (망원동, 가은빌딩) 전화번호는 02-324-2495 입니다."
1514,서울 마포구 구수동,"병원명은 박찬이비인후과의원 주소는 서울특별시 마포구 창전로 60, 4층 (구수동) 전화번호는 02-313-5675 입니다."
1515,서울 마포구 성산동,"병원명은 백신경외과의원 주소는 서울특별시 마포구 월드컵로 128, (성산동) 전화번호는 02-334-8822 입니다."
1516,서울 마포구 서교동,"병원명은 베스트본의원한의원 주소는 서울특별시 마포구 월드컵북로 19, 5,6층 (서교동, 대상빌딩) 전화번호는 정보없음 입니다."
1517,서울 마포구 서교동,"병원명은 베스트신경외과의원 주소는 서울특별시 마포구 양화로 81, H 스퀘어 2층 (서교동) 전화번호는 02-6953-7177 입니다."
1518,서울 마포구 상암동,"병원명은 별소아청소년과의원 주소는 서울특별시 마포구 월드컵북로 347, 4층 401호 (상암동, 상암메디컬빌딩) 전화번호는 02-375-7583 입니다."
1519,서울 마포구 아현동,"병원명은 보아스이비인후과의원 주소는 서울특별시 마포구 마포대로24길 56, 6층 (아현동, 보령빌딩) 전화번호는 02-392-0079 입니다."
1520,서울 마포구 대흥동,"병원명은 봄봄소아청소년과의원 주소는 서울특별시 마포구 고산18길 13, 4층 401~403호 (대흥동) 전화번호는 02-711-2042 입니다."
1521,서울 마포구 염리동,"병원명은 삼백초한의원 주소는 서울특별시 마포구 숭문길 58, 염리삼성래미안 2층 204, 205호 (염리동) 전화번호는 02-717-7599 입니다."
1522,서울 마포구 신수동,"병원명은 삼성드림소아청소년과의원 주소는 서울특별시 마포구 서강로 106, 3층 (신수동) 전화번호는 02-703-0098 입니다."
1523,서울 마포구 아현동,"병원명은 삼성푸른소아청소년과의원 주소는 서울특별시 마포구 마포대로 201, 1층 (아현동, 트라팰리스2차, 110호, 111호 일부) 전화번호는 070-5055-6060 입니다."
1524,서울 마포구 상암동,"병원명은 상암우리내과의원 주소는 서울특별시 마포구 월드컵북로 347, 402호 (상암동, 상암메디칼빌딩) 전화번호는 정보없음 입니다."
1525,서울 마포구 성산동,"병원명은 생생당한의원 주소는 서울특별시 마포구 성미산로 80, 2층 (성산동) 전화번호는 02-333-5177 입니다."
1526,서울 마포구 망원동,"병원명은 서울가정의학과의원 주소는 서울특별시 마포구 포은로 68, 2층 (망원동) 전화번호는 02-323-9102 입니다."
1527,서울 마포구 서교동,"병원명은 서울본내과의원 주소는 서울특별시 마포구 양화로 133, 서교타워 3,5,18층 (서교동) 전화번호는 02-3143-2220 입니다."
1528,서울 마포구 망원동,"병원명은 서울안내과의원 주소는 서울특별시 마포구 월드컵로 75, 3층 (망원동) 전화번호는 02-325-8708 입니다."
1529,서울 마포구 도화동,"병원명은 서울이비인후과의원 주소는 서울특별시 마포구 도화길 32, 407호 (도화동, 삼성아파트상가동) 전화번호는 02-716-5075 입니다."
1530,서울 마포구 서교동,"병원명은 선내과의원 주소는 서울특별시 마포구 월드컵로 82, 2층 (서교동, 소단빌딩) 전화번호는 02-332-5800 입니다."
1531,서울 마포구 대흥동,"병원명은 센스이비인후과의원 주소는 서울특별시 마포구 숭문길 221, 2층 (대흥동) 전화번호는 02-706-5085 입니다."
1532,서울 마포구 상암동,"병원명은 수이비인후과의원 주소는 서울특별시 마포구 상암산로1길 73, 302호 (상암동, 월드프라자) 전화번호는 02-373-5075 입니다."
1533,서울 마포구 노고산동,"병원명은 숭실한의원 주소는 서울특별시 마포구 서강로 131, 1층,2층,3층,4층 (노고산동, 신촌아이스페이스오피스텔) 전화번호는 02-333-1075 입니다."
1534,서울 마포구 망원동,"병원명은 신계원소아청소년과의원 주소는 서울특별시 마포구 망원로 74-1, 2층 (망원동) 전화번호는 02-338-4786 입니다."
1535,서울 마포구 대흥동,"병원명은 신촌바른내과의원 주소는 서울특별시 마포구 신촌로 174, 3층 301,302호 (대흥동) 전화번호는 02-3275-1003 입니다."
1536,서울 마포구 신수동,"병원명은 신촌연세병원 주소는 서울특별시 마포구 서강로 110, 지2층~6층 (신수동) 전화번호는 02-337-7582 입니다."
1537,서울 마포구 노고산동,"병원명은 신촌연세이비인후과의원 주소는 서울특별시 마포구 신촌로 88, 5층 (노고산동, 태영빌딩) 전화번호는 02-332-0927 입니다."
1538,서울 마포구 신수동,"병원명은 신촌연세퀸산부인과의원 주소는 서울특별시 마포구 서강로 106, 5,6,7층 (신수동) 전화번호는 02-718-0055 입니다."
1539,서울 마포구 아현동,"병원명은 아산편한내과의원 주소는 서울특별시 마포구 신촌로 266, 3층 (아현동) 전화번호는 정보없음 입니다."
1540,서울 마포구 도화동,"병원명은 안중한의원 주소는 서울특별시 마포구 마포대로4나길 13, (도화동) 전화번호는 02-712-0772 입니다."
1541,서울 마포구 공덕동,"병원명은 앤의원 주소는 서울특별시 마포구 만리재로 15, 403~406호 (공덕동, 제일빌딩) 전화번호는 02-717-7726 입니다."
1542,서울 마포구 도화동,"병원명은 양대원내과의원 주소는 서울특별시 마포구 도화길 32, 303호, 304호 (도화동, 삼성아파트상가동) 전화번호는 02-703-8543 입니다."
1543,서울 마포구 동교동,"병원명은 양이비인후과의원 주소는 서울특별시 마포구 양화로 156, 305호 (동교동, LG팰리스빌딩) 전화번호는 02-333-9050 입니다."
1544,서울 마포구 성산동,"병원명은 에스엠씨요양병원 주소는 서울특별시 마포구 월드컵북로 165, 지하1층~5층 (성산동, SMC) 전화번호는 02-374-3111 입니다."
1545,서울 마포구 연남동,"병원명은 연세가정의학과의원 주소는 서울특별시 마포구 연희로 37, 2층 (연남동) 전화번호는 02-323-9869 입니다."
1546,서울 마포구 노고산동,"병원명은 연세김진민의원 주소는 서울특별시 마포구 신촌로 78, 2층 (노고산동) 전화번호는 02-718-0131 입니다."
1547,서울 마포구 상암동,"병원명은 연세나무소아청소년과의원 주소는 서울특별시 마포구 월드컵북로 502, 201호 (상암동, 월드컵파크프라자) 전화번호는 02-305-9500 입니다."
1548,서울 마포구 합정동,"병원명은 연세더블유의원 주소는 서울특별시 마포구 양화로 48, 2,3,4층 (합정동) 전화번호는 02-326-0365 입니다."
1549,서울 마포구 동교동,"병원명은 연세봄이비인후과의원 주소는 서울특별시 마포구 양화로 152, 4층 (동교동, 대화빌딩) 전화번호는 02-325-4195 입니다."
1550,서울 마포구 공덕동,"병원명은 연세소리이비인후과의원 주소는 서울특별시 마포구 백범로31길 7, 2층 203,204,205호 (공덕동, 공덕SK리더스뷰) 전화번호는 02-701-1199 입니다."
1551,서울 마포구 아현동,"병원명은 연세소아청소년과의원 주소는 서울특별시 마포구 만리재로 133, 5층 (아현동) 전화번호는 02-393-0119 입니다."
1552,서울 마포구 망원동,"병원명은 연세시원정형외과의원 주소는 서울특별시 마포구 월드컵로 79, 5층 (망원동, 유용빌딩) 전화번호는 02-336-7575 입니다."
1553,서울 마포구 공덕동,"병원명은 연세외과의원 주소는 서울특별시 마포구 마포대로16길 6, 1~2층 (공덕동) 전화번호는 02-715-6198 입니다."
1554,서울 마포구 노고산동,"병원명은 연세우리내과의원 주소는 서울특별시 마포구 백범로 10, 101,201호 (노고산동, 현대벤쳐빌) 전화번호는 02-334-7560 입니다."
1555,서울 마포구 동교동,"병원명은 연세위더스여성의원 주소는 서울특별시 마포구 양화로 178, 11층 (동교동, 목화빌딩) 전화번호는 02-323-1194 입니다."
1556,서울 마포구 도화동,"병원명은 연세유내과의원 주소는 서울특별시 마포구 도화길 32, 201호 (도화동, 삼성아파트상가동) 전화번호는 02-701-5131 입니다."
1557,서울 마포구 중동,"병원명은 연세이비인후과의원 주소는 서울특별시 마포구 월드컵북로38길 14, 4층 (중동, 오윤빌딩) 전화번호는 02-375-8275 입니다."
1558,서울 마포구 성산동,"병원명은 연세참가정의원 주소는 서울특별시 마포구 월드컵북로 69, 2층 (성산동) 전화번호는 02-3143-1331 입니다."
1559,서울 마포구 망원동,"병원명은 열린성모이비인후과의원 주소는 서울특별시 마포구 월드컵로 75, 2층 (망원동) 전화번호는 02-335-7585 입니다."
1560,서울 마포구 창전동,"병원명은 영재소아청소년과의원 주소는 서울특별시 마포구 창전로 45, 103동 110호 (창전동, 서강한화오벨리스크) 전화번호는 02-706-1275 입니다."
1561,서울 마포구 성산동,"병원명은 예선한의원 주소는 서울특별시 마포구 성미산로 21-1, 제일빌딩 2층 (성산동) 전화번호는 02-337-7975 입니다."
1562,서울 마포구 도화동,"병원명은 예일한의원 주소는 서울특별시 마포구 도화길 32, 삼성아파트 상가동 4층 401,402호 (도화동) 전화번호는 02-365-7533 입니다."
1563,서울 마포구 망원동,"병원명은 우리가정의학과의원 주소는 서울특별시 마포구 월드컵로25길 58, (망원동) 전화번호는 02-325-1575 입니다."
1564,서울 마포구 신수동,"병원명은 우리들가정의학과의원 주소는 서울특별시 마포구 토정로 219, (신수동) 전화번호는 02-716-5700 입니다."
1565,서울 마포구 아현동,"병원명은 우리미래의원 주소는 서울특별시 마포구 마포대로24길 4, 공덕자이아파트 상가 304~305호 (아현동) 전화번호는 02-392-7505 입니다."
1566,서울 마포구 공덕동,"병원명은 원광좋은한의원 주소는 서울특별시 마포구 마포대로8길 9, 302호 (공덕동, 영명빌딩) 전화번호는 02-711-3531 입니다."
1567,서울 마포구 아현동,"병원명은 위비앙병원 주소는 서울특별시 마포구 신촌로 240, (아현동) 전화번호는 02-6207-8811 입니다."
1568,서울 마포구 창전동,"병원명은 유내과의원 주소는 서울특별시 마포구 서강로 97, 410호 (창전동, 창전동삼성아파트상가동) 전화번호는 02-332-6657 입니다."
1569,서울 마포구 서교동,"병원명은 이내과의원 주소는 서울특별시 마포구 양화로 64, 3층 (서교동, 서교제일빌딩) 전화번호는 02-332-1708 입니다."
1570,서울 마포구 노고산동,"병원명은 이브산부인과의원 주소는 서울특별시 마포구 서강로 144, 4층 5호 (노고산동) 전화번호는 02-6368-2323 입니다."
1571,서울 마포구 망원동,"병원명은 이승호이비인후과의원 주소는 서울특별시 마포구 월드컵로 111, 2층 (망원동, 풍성빌딩) 전화번호는 02-334-7582 입니다."
1572,서울 마포구 망원동,"병원명은 정내과의원 주소는 서울특별시 마포구 망원로 82, 2층 (망원동) 전화번호는 02-336-7570 입니다."
1573,서울 마포구 염리동,"병원명은 정다운소아청소년과의원 주소는 서울특별시 마포구 대흥로24길 24, 마포프레스티지자이 상가A동 2층 202호 (염리동) 전화번호는 02-6403-8700 입니다."
1574,서울 마포구 공덕동,"병원명은 정성일내과의원 주소는 서울특별시 마포구 마포대로 143, 212호 (공덕동, 마포파크팰리스) 전화번호는 02-717-5250 입니다."
1575,서울 마포구 서교동,"병원명은 제생한의원 주소는 서울특별시 마포구 양화로12길 8-9, 예현빌딩 4층 (서교동) 전화번호는 02-324-8786 입니다."
1576,서울 마포구 성산동,"병원명은 제일성모가정의학과의원 주소는 서울특별시 마포구 월드컵북로 137, 3층 301호 (성산동, 제일성모메디칼센터) 전화번호는 02-333-4365 입니다."
1577,서울 마포구 성산동,"병원명은 제일소아청소년과의원 주소는 서울특별시 마포구 월드컵북로 137, 3층 (성산동) 전화번호는 02-333-0921 입니다."
1578,서울 마포구 신공덕동,"병원명은 조앤필이비인후과의원 주소는 서울특별시 마포구 백범로 202, 201,202,203,217호 (신공덕동, 마포케이씨씨웰츠타워) 전화번호는 02-6401-1111 입니다."
1579,서울 마포구 망원동,"병원명은 조은샘의원 주소는 서울특별시 마포구 망원로8길 53, 2층 (망원동) 전화번호는 정보없음 입니다."
1580,서울 마포구 용강동,"병원명은 조은영소아청소년과의원 주소는 서울특별시 마포구 토정로31길 24, (용강동, e편한세상마포3차 A상가 B116호, 117호 일부) 전화번호는 02-719-7579 입니다."
1581,서울 마포구 도화동,"병원명은 참길이비인후과의원 주소는 서울특별시 마포구 마포대로 44, 302호 (도화동, 진도빌딩) 전화번호는 02-703-6050 입니다."
1582,서울 마포구 중동,"병원명은 최이비인후과의원 주소는 서울특별시 마포구 월드컵북로 230, (중동, 현대상가) 전화번호는 02-323-9102 입니다."
1583,서울 마포구 중동,"병원명은 최지원소아청소년과의원 주소는 서울특별시 마포구 월드컵북로38길 14, 3층 (중동) 전화번호는 02-376-2131 입니다."
1584,서울 마포구 염리동,"병원명은 최호열내과의원 주소는 서울특별시 마포구 백범로 127, 2층 (염리동) 전화번호는 02-3274-0301 입니다."
1585,서울 마포구 공덕동,"병원명은 코넬비뇨기과의원 주소는 서울특별시 마포구 만리재로 15, 제일빌딩 2층 205호 (공덕동) 전화번호는 02-718-7575 입니다."
1586,서울 마포구 도화동,"병원명은 코이젠이비인후과의원 주소는 서울특별시 마포구 마포대로 68, 206~210-1호 (도화동, 마포아크로타워) 전화번호는 02-2135-8808 입니다."
1587,서울 마포구 신공덕동,"병원명은 튼튼사랑소아청소년과의원 주소는 서울특별시 마포구 백범로37길 26, 3층 (신공덕동) 전화번호는 02-702-2191 입니다."
1588,서울 마포구 용강동,"병원명은 포도나무정형외과의원 주소는 서울특별시 마포구 대흥로 34, 2~4층 (용강동) 전화번호는 02-704-1051 입니다."
1589,서울 마포구 아현동,"병원명은 푸른성모이비인후과의원 주소는 서울특별시 마포구 마포대로 195, (아현동, 마포래미안푸르지오상가 4-206, 207) 전화번호는 02-365-2580 입니다."
1590,서울 마포구 합정동,"병원명은 푸른이비인후과의원 주소는 서울특별시 마포구 독막로 2, 2층 (합정동) 전화번호는 02-322-7757 입니다."
1591,서울 마포구 염리동,"병원명은 프라나이비인후과의원 주소는 서울특별시 마포구 대흥로24길 24, 지2층 213~215호 (염리동) 전화번호는 02-525-1713 입니다."
1592,서울 마포구 망원동,"병원명은 필한의원 주소는 서울특별시 마포구 망원로 71, 2층 (망원동) 전화번호는 02-335-3322 입니다."
1593,서울 마포구 아현동,"병원명은 한빛가정의원 주소는 서울특별시 마포구 신촌로34길 37, 2층 (아현동) 전화번호는 02-363-8000 입니다."
1594,서울 마포구 아현동,"병원명은 한사랑의원 주소는 서울특별시 마포구 만리재로 133, 3층 (아현동) 전화번호는 02-363-9114 입니다."
1595,서울 마포구 망원동,"병원명은 한사랑의원 주소는 서울특별시 마포구 월드컵로 123, 2층 (망원동) 전화번호는 02-334-6866 입니다."
