,Q,A
798,서울 광진구 자양동,"병원명은 늘푸른연세의원 주소는 서울특별시 광진구 뚝섬로27길 65, 2층 (자양동) 전화번호는 02-461-2598 입니다."
799,서울 광진구 중곡동,"병원명은 닥터스마일의원 주소는 서울특별시 광진구 능동로51길 44, (중곡동) 전화번호는 02-467-3650 입니다."
800,서울 광진구 중곡동,"병원명은 더불어내과의원 주소는 서울특별시 광진구 긴고랑로 41, 2층 (중곡동) 전화번호는 02-469-7577 입니다."
801,서울 광진구 구의동,"병원명은 드림이비인후과의원 주소는 서울특별시 광진구 아차산로 373, (구의동) 전화번호는 02-6248-3100 입니다."
802,서울 광진구 구의동,"병원명은 만택루쎄의원 주소는 서울특별시 광진구 광나루로 614, 6.7.8층 (구의동) 전화번호는 02-456-5333 입니다."
803,서울 광진구 자양동,"병원명은 명소아청소년과의원 주소는 서울특별시 광진구 뚝섬로 552, 203호 (자양동) 전화번호는 02-455-1194 입니다."
804,서울 광진구 중곡동,"병원명은 명이비인후과의원 주소는 서울특별시 광진구 용마산로 5, 5층 (중곡동) 전화번호는 02-444-4322 입니다."
805,서울 광진구 자양동,"병원명은 모아재활의학과소아청소년과의원 주소는 서울특별시 광진구 뚝섬로 587, 4층 (자양동) 전화번호는 02-6959-7075 입니다."
806,서울 광진구 자양동,"병원명은 박남미이비인후과의원 주소는 서울특별시 광진구 뚝섬로 497, (자양동) 전화번호는 02-461-0711 입니다."
807,서울 광진구 자양동,"병원명은 벗이비인후과의원 주소는 서울특별시 광진구 뚝섬로 558, 대양빌딩 202호 (자양동) 전화번호는 02-6953-5805 입니다."
808,서울 광진구 화양동,"병원명은 별이비인후과의원 주소는 서울특별시 광진구 능동로 111, 3층 (화양동) 전화번호는 02-3409-9788 입니다."
809,서울 광진구 구의동,"병원명은 비타민의원 주소는 서울특별시 광진구 천호대로 671, 파크타운 204호 (구의동) 전화번호는 02-446-8881 입니다."
810,서울 광진구 구의동,"병원명은 삼성서울이비인후과의원 주소는 서울특별시 광진구 아차산로 466, 트리니티 빌딩 6층 (구의동) 전화번호는 02-455-6777 입니다."
811,서울 광진구 자양동,"병원명은 삼성제일외과의원 주소는 서울특별시 광진구 뚝섬로 613, 2층 (자양동) 전화번호는 02-458-8921 입니다."
812,서울 광진구 구의동,"병원명은 삼성키즈소아청소년과의원 주소는 서울특별시 광진구 아차산로 478, 4층 (구의동) 전화번호는 02-452-7787 입니다."
813,서울 광진구 중곡동,"병원명은 샤인소아청소년과의원 주소는 서울특별시 광진구 용마산로 57, 1층 (중곡동) 전화번호는 02-562-8275 입니다."
814,서울 광진구 자양동,"병원명은 서소아과의원 주소는 서울특별시 광진구 뚝섬로 631-1, (자양동) 전화번호는 02-444-3106 입니다."
815,서울 광진구 화양동,"병원명은 서울가정의원 주소는 서울특별시 광진구 아차산로29길 51, 2층 (화양동) 전화번호는 02-469-8050 입니다."
816,서울 광진구 자양동,"병원명은 서울건강내과의원 주소는 서울특별시 광진구 자양로15길 51-1, 진덕빌딩 2층 (자양동) 전화번호는 02-456-7542 입니다."
817,서울 광진구 구의동,"병원명은 서울내외의원 주소는 서울특별시 광진구 구의강변로 99, (구의동) 전화번호는 02-456-7001 입니다."
818,서울 광진구 구의동,"병원명은 서울엘리트가정의원 주소는 서울특별시 광진구 구의로 23, 2층 (구의동) 전화번호는 02-2201-3375 입니다."
819,서울 광진구 자양동,"병원명은 서울엠비(MB)내과의원 주소는 서울특별시 광진구 능동로 18, (자양동, 이튼타워 3차 113호,114호,116호,117호) 전화번호는 02-466-9100 입니다."
820,서울 광진구 자양동,"병원명은 서울이비인후과의원 주소는 서울특별시 광진구 자양로 95, 7층 (자양동) 전화번호는 02-455-7700 입니다."
821,서울 광진구 자양동,"병원명은 서울현대정형외과의원 주소는 서울특별시 광진구 아차산로30길 39, 2층 (자양동) 전화번호는 02-466-3119 입니다."
822,서울 광진구 자양동,"병원명은 성동고려의원 주소는 서울특별시 광진구 자양로 43, (자양동) 전화번호는 02-453-1102 입니다."
823,서울 광진구 구의동,"병원명은 성모푸른내과의원 주소는 서울특별시 광진구 구의로 7, 2층 (구의동) 전화번호는 02-6094-7575 입니다."
824,서울 광진구 중곡동,"병원명은 송상언의원 주소는 서울특별시 광진구 능동로 318, 2층 (중곡동, 정우빌딩) 전화번호는 02-2201-8275 입니다."
825,서울 광진구 광장동,"병원명은 수가정의학과의원 주소는 서울특별시 광진구 아차산로 502, 2층 205호 (광장동, 진넥스 오딧세이) 전화번호는 02-3436-1117 입니다."
826,서울 광진구 구의동,"병원명은 시원누리내과의원 주소는 서울특별시 광진구 천호대로 670, 썬-타워빌딩 4층 (구의동) 전화번호는 02-2088-5088 입니다."
827,서울 광진구 중곡동,"병원명은 신성내과의원 주소는 서울특별시 광진구 능동로 378, (중곡동) 전화번호는 02-446-8293 입니다."
828,서울 광진구 자양동,"병원명은 신일외과의원 주소는 서울특별시 광진구 뚝섬로 511, (자양동) 전화번호는 02-466-8397 입니다."
829,서울 광진구 중곡동,"병원명은 신혜성의원 주소는 서울특별시 광진구 면목로 147, 3층 (중곡동, 삼영빌딩) 전화번호는 02-3409-5511 입니다."
830,서울 광진구 중곡동,"병원명은 아가사랑소아청소년과의원 주소는 서울특별시 광진구 면목로 117, 2층 (중곡동, 바론채) 전화번호는 02-465-9813 입니다."
831,서울 광진구 자양동,"병원명은 아산박내과의원 주소는 서울특별시 광진구 뚝섬로 498, 서울클리닉빌딩 2층 (자양동) 전화번호는 02-464-1960 입니다."
832,서울 광진구 자양동,"병원명은 아산한빛의원 주소는 서울특별시 광진구 자양로 42, 3층 (자양동) 전화번호는 02-444-5765 입니다."
833,서울 광진구 구의동,"병원명은 아이쑥쑥소아청소년과의원 주소는 서울특별시 광진구 광나루로 604, (구의동, 진넥스베르디엠 2층, 202호) 전화번호는 02-456-6119 입니다."
834,서울 광진구 구의동,"병원명은 아이코이비인후과의원 주소는 서울특별시 광진구 자양로 287, 3층 (구의동) 전화번호는 02-453-1920 입니다."
835,서울 광진구 광장동,"병원명은 어광수가정의학과의원 주소는 서울특별시 광진구 아차산로69길 8, 지하1,지상2층 (광장동) 전화번호는 02-3436-0511 입니다."
836,서울 광진구 중곡동,"병원명은 엄민숙소아청소년과의원 주소는 서울특별시 광진구 용마산로 46, 2층 (중곡동) 전화번호는 02-455-6025 입니다."
837,서울 광진구 중곡동,"병원명은 연세가정의원 주소는 서울특별시 광진구 면목로 130, 2층 (중곡동) 전화번호는 02-463-0875 입니다."
838,서울 광진구 중곡동,"병원명은 연세다인의원 주소는 서울특별시 광진구 면목로 173, 2층 (중곡동) 전화번호는 02-467-1532 입니다."
839,서울 광진구 자양동,"병원명은 연세미초롬의원 주소는 서울특별시 광진구 자양로13길 47, 2층 (자양동) 전화번호는 02-444-6326 입니다."
840,서울 광진구 구의동,"병원명은 연세이비인후과의원 주소는 서울특별시 광진구 구의강변로 106, 210호 (구의동, 삼성쉐르빌) 전화번호는 02-3437-9095 입니다."
841,서울 광진구 중곡동,"병원명은 열린이비인후과의원 주소는 서울특별시 광진구 면목로 126, (중곡동) 전화번호는 02-461-7505 입니다."
842,서울 광진구 구의동,"병원명은 오석한방병원 주소는 서울특별시 광진구 자양로 116, 301~307호,310~312호 (구의동, 웰츠타워) 전화번호는 02-454-7582 입니다."
843,서울 광진구 중곡동,"병원명은 유앤장이비인후과의원 주소는 서울특별시 광진구 천호대로 653, (중곡동) 전화번호는 02-447-0077 입니다."
844,서울 광진구 광장동,"병원명은 이내과의원 주소는 서울특별시 광진구 아차산로 502, (광장동,진넥스오딧세이 303호) 전화번호는 02-458-6400 입니다."
845,서울 광진구 중곡동,"병원명은 이우창연세마취통증의학과의원 주소는 서울특별시 광진구 용마산로 57, 2층 (중곡동) 전화번호는 02-456-8876 입니다."
846,서울 광진구 중곡동,"병원명은 이화소아청소년과의원 주소는 서울특별시 광진구 천호대로111길 19, 2층 (중곡동) 전화번호는 02-456-5667 입니다."
847,서울 광진구 구의동,"병원명은 임성준신경외과의원 주소는 서울특별시 광진구 구의강변로 106, (구의동,삼성쉐르빌 2층) 전화번호는 02-454-5788 입니다."
848,서울 광진구 구의동,"병원명은 장미영내과의원 주소는 서울특별시 광진구 광나루로 542, (구의동) 전화번호는 02-2201-3020 입니다."
849,서울 광진구 군자동,"병원명은 장병일이비인후과의원 주소는 서울특별시 광진구 천호대로 548, 3층 (군자동) 전화번호는 02-466-2830 입니다."
850,서울 광진구 자양동,"병원명은 정문호소아과의원 주소는 서울특별시 광진구 자양로 48, 2층 (자양동) 전화번호는 02-452-9085 입니다."
851,서울 광진구 중곡동,"병원명은 정이비인후과의원 주소는 서울특별시 광진구 용마산로 53, (중곡동) 전화번호는 02-456-4503 입니다."
852,서울 광진구 군자동,"병원명은 제민정형외과의원 주소는 서울특별시 광진구 광나루로 355, 지하1.4층 (군자동) 전화번호는 02-466-0346 입니다."
853,서울 광진구 자양동,"병원명은 조내과의원 주소는 서울특별시 광진구 뚝섬로 496, (자양동,(2,3층)) 전화번호는 02-498-6144 입니다."
854,서울 광진구 구의동,"병원명은 지킴내과의원 주소는 서울특별시 광진구 광나루로 614, (구의동,만택빌딩 3층) 전화번호는 02-2201-2210 입니다."
855,서울 광진구 구의동,"병원명은 지킴소아과의원 주소는 서울특별시 광진구 구의강변로 106, 213호 (구의동, 삼성쉐르빌) 전화번호는 02-2201-2260 입니다."
856,서울 광진구 구의동,"병원명은 진광준외과의원 주소는 서울특별시 광진구 광나루로36길 14, 2층 (구의동) 전화번호는 02-452-6556 입니다."
857,서울 광진구 군자동,"병원명은 진이비인후과의원 주소는 서울특별시 광진구 광나루로 355, 5층 (군자동, 광진 메디컬센터) 전화번호는 02-464-7585 입니다."
858,서울 광진구 구의동,"병원명은 참조은의원 주소는 서울특별시 광진구 광나루로 529, (구의동) 전화번호는 02-455-5601 입니다."
859,서울 광진구 자양동,"병원명은 최이비인후과의원 주소는 서울특별시 광진구 자양로 113, 4층 402호 (자양동, 구의 현대 하이엘) 전화번호는 02-457-2002 입니다."
860,서울 광진구 자양동,"병원명은 최진소아청소년과의원 주소는 서울특별시 광진구 뚝섬로 590, 2층 (자양동) 전화번호는 02-447-6610 입니다."
861,서울 광진구 중곡동,"병원명은 코즈이비인후과의원 주소는 서울특별시 광진구 천호대로 557, 풍국빌딩 101호 (중곡동) 전화번호는 02-446-5571 입니다."
862,서울 광진구 자양동,"병원명은 퀸산부인과의원 주소는 서울특별시 광진구 자양로 65, 3층 (자양동) 전화번호는 02-457-3575 입니다."
863,서울 광진구 중곡동,"병원명은 큰사랑의원 주소는 서울특별시 광진구 면목로 203, 2층 (중곡동) 전화번호는 02-491-8549 입니다."
864,서울 광진구 중곡동,"병원명은 큰열매여성의원 주소는 서울특별시 광진구 용마산로 23, 1.2.3층 (중곡동) 전화번호는 02-454-3572 입니다."
865,서울 광진구 자양동,"병원명은 키즈엘소아청소년과의원 주소는 서울특별시 광진구 능동로 18, 202호 (자양동, 이튼타워리버3차) 전화번호는 02-468-2020 입니다."
866,서울 광진구 자양동,"병원명은 푸른꿈소아과의원 주소는 서울특별시 광진구 뚝섬로 657, (자양동) 전화번호는 02-2201-2551 입니다."
867,서울 광진구 화양동,"병원명은 피부사랑의원 주소는 서울특별시 광진구 능동로 103, 5층 (화양동) 전화번호는 02-469-9757 입니다."
868,서울 광진구 자양동,"병원명은 한강한의원 주소는 서울특별시 광진구 자양번영로 46, 1층 (자양동) 전화번호는 02-6956-8875 입니다."
869,서울 광진구 군자동,"병원명은 한성욱내과의원 주소는 서울특별시 광진구 군자로 85, (군자동) 전화번호는 02-466-4189 입니다."
870,서울 광진구 중곡동,"병원명은 한솔마취통증의학과의원 주소는 서울특별시 광진구 천호대로 653, 4층 (중곡동) 전화번호는 02-446-3480 입니다."
871,서울 광진구 구의동,"병원명은 해맑은소아과의원 주소는 서울특별시 광진구 자양로 288, 2층 (구의동) 전화번호는 02-3437-3722 입니다."
872,서울 광진구 자양동,"병원명은 혜민병원 주소는 서울특별시 광진구 자양로 85, (자양동) 전화번호는 02-2049-9000 입니다."
873,서울 광진구 중곡동,"병원명은 희망내과의원 주소는 서울특별시 광진구 천호대로 527, 거산빌딩 2층 (중곡동) 전화번호는 02-468-0575 입니다."
874,서울 구로구 오류동,"병원명은 365더튼튼의원 주소는 서울특별시 구로구 경인로 191, 2,3층 (오류동) 전화번호는 02-2060-9111 입니다."
875,서울 구로구 개봉동,"병원명은 강서내과의원 주소는 서울특별시 구로구 개봉로 57, 3층 (개봉동) 전화번호는 02-2615-7212 입니다."
876,서울 구로구 오류동,"병원명은 건강드림내과의원 주소는 서울특별시 구로구 천왕로 106, 골드프라자 (오류동) 전화번호는 02-2684-7575 입니다."
877,서울 구로구 고척동,"병원명은 고광송일반외과의원 주소는 서울특별시 구로구 고척로 148, (고척동) 전화번호는 02-2684-7170 입니다."
878,서울 구로구 구로동,"병원명은 고려튼튼외과의원 주소는 서울특별시 구로구 구로동로 153, 이스턴프라자 3~5층 (구로동) 전화번호는 02-857-8511 입니다."
879,서울 구로구 구로동,"병원명은 구로성모의원 주소는 서울특별시 구로구 가마산로 220, 동성빌딩 2층 (구로동) 전화번호는 02-853-7005 입니다."
880,서울 구로구 고척동,"병원명은 구로성심병원 주소는 서울특별시 구로구 경인로 427, 구로성심병원 (고척동) 전화번호는 02-2067-1500 입니다."
881,서울 구로구 리봉동,"병원명은 구로세란의원 주소는 서울특별시 구로구 디지털로 227, 새안빌딩 3층 (가리봉동) 전화번호는 정보없음 입니다."
882,서울 구로구 오류동,"병원명은 구로센트럴이비인후과의원 주소는 서울특별시 구로구 경인로 176, 4층 (오류동, 시티월드) 전화번호는 02-2615-8321 입니다."
883,서울 구로구 고척동,"병원명은 구로연세소아과의원 주소는 서울특별시 구로구 경인로 373, 문화골든타워 2층 (고척동) 전화번호는 02-2611-3200 입니다."
884,서울 구로구 구로동,"병원명은 구로연세의원 주소는 서울특별시 구로구 구로중앙로 16, 2,3층 (구로동) 전화번호는 02-858-7776 입니다."
885,서울 구로구 구로동,"병원명은 구로정형외과의원 주소는 서울특별시 구로구 가마산로 211, 외5필지동 4,5,6층 (구로동) 전화번호는 02-852-3375 입니다."
886,서울 구로구 구로동,"병원명은 구로제일의원 주소는 서울특별시 구로구 공원로8길 23, 2층 (구로동) 전화번호는 02-855-1380 입니다."
887,서울 구로구 구로동,"병원명은 구로현대의원 주소는 서울특별시 구로구 구로동로 179, (구로동) 전화번호는 02-864-2559 입니다."
888,서울 구로구 구로동,"병원명은 구일가정의원 주소는 서울특별시 구로구 구일로10길 49, (구로동, 다원그린빌) 전화번호는 02-863-9188 입니다."
889,서울 구로구 구로동,"병원명은 구일굿모닝내과의원 주소는 서울특별시 구로구 구일로 110, 해원리버파크 3층 (구로동) 전화번호는 02-866-9175 입니다."
890,서울 구로구 구로동,"병원명은 굿이비인후과의원 주소는 서울특별시 구로구 디지털로34길 55, 코오롱싸이언스밸리2차 213,214호 (구로동) 전화번호는 02-865-7595 입니다."
891,서울 구로구 구로동,"병원명은 김경효소아과의원 주소는 서울특별시 구로구 구일로8길 92, 205호 (구로동, 중앙구로하이츠아파트) 전화번호는 02-867-9570 입니다."
892,서울 구로구 구로동,"병원명은 김성목내과의원 주소는 서울특별시 구로구 도림로 73, 인성빌딩 2층 (구로동) 전화번호는 02-855-7533 입니다."
893,서울 구로구 고척동,"병원명은 김진아소아과의원 주소는 서울특별시 구로구 고척로 142-1, (고척동) 전화번호는 02-2616-4119 입니다."
894,서울 구로구 구로동,"병원명은 김현정이비인후과의원 주소는 서울특별시 구로구 구일로4길 30, 신영상가 (구로동) 전화번호는 02-853-7360 입니다."
895,서울 구로구 오류동,"병원명은 남광우내과의원 주소는 서울특별시 구로구 경인로 219, (오류동) 전화번호는 02-2617-1025 입니다."
896,서울 구로구 구로동,"병원명은 늘푸른소아청소년과의원 주소는 서울특별시 구로구 구로중앙로 68, 311,312호 (구로동, 신안타워) 전화번호는 02-838-2233 입니다."
897,서울 구로구 구로동,"병원명은 다올항외과의원 주소는 서울특별시 구로구 경인로 572, 스타팰리스 4층 (구로동) 전화번호는 02-2672-8275 입니다."
898,서울 구로구 구로동,"병원명은 닥터수의원 주소는 서울특별시 구로구 디지털로 300, 지밸리비즈플라자 B1층 13호 (구로동) 전화번호는 02-6344-3988 입니다."
899,서울 구로구 구로동,"병원명은 더케이내과의원 주소는 서울특별시 구로구 가마산로 232, 1층 (구로동, 스페스큐브) 전화번호는 02-6734-0511 입니다."
900,서울 구로구 오류동,"병원명은 덕산속조은내과의원 주소는 서울특별시 구로구 경인로 176, 4층 401호 (오류동, 시티월드) 전화번호는 02-2685-9500 입니다."
901,서울 구로구 항동,"병원명은 동그라미소아청소년과의원 주소는 서울특별시 구로구 서해안로 2098, 항동프라자 5층 501호 (항동) 전화번호는 02-2038-8610 입니다."
902,서울 구로구 신도림동,"병원명은 디에이치(DH)대항외과의원 주소는 서울특별시 구로구 경인로 661, 신도림1차푸르지오 259호 (신도림동) 전화번호는 02-3439-8114 입니다."
903,서울 구로구 구로동,"병원명은 마음속내과의원 주소는 서울특별시 구로구 구로동로 115, 청보빌딩 501호 (구로동) 전화번호는 02-859-5999 입니다."
904,서울 구로구 개봉동,"병원명은 맑은성모이비인후과의원 주소는 서울특별시 구로구 개봉로20길 6, 2층 (개봉동, 현대아파트1단지) 전화번호는 정보없음 입니다."
905,서울 구로구 개봉동,"병원명은 메디서울이비인후과의원 주소는 서울특별시 구로구 고척로 123-1, 2,3층 (개봉동) 전화번호는 02-2619-3119 입니다."
906,서울 구로구 개봉동,"병원명은 메디원의원 주소는 서울특별시 구로구 경인로40길 12, 2층, 3층 일부층 (개봉동) 전화번호는 02-2611-0050 입니다."
907,서울 구로구 오류동,"병원명은 문희식내과의원 주소는 서울특별시 구로구 경인로 201, 2층 (오류동) 전화번호는 02-2612-2730 입니다."
908,서울 구로구 개봉동,"병원명은 민전산부인과의원 주소는 서울특별시 구로구 경인로 322, 1,2,4,5층 (개봉동) 전화번호는 02-2685-3388 입니다."
909,서울 구로구 오류동,"병원명은 바른정형외과의원 주소는 서울특별시 구로구 오류로8길 57, 대성빌딩 2층 (오류동) 전화번호는 정보없음 입니다."
910,서울 구로구 개봉동,"병원명은 박철수내과의원 주소는 서울특별시 구로구 개봉로 30, 3층 (개봉동, 로얄타워) 전화번호는 02-2681-7575 입니다."
911,서울 구로구 개봉동,"병원명은 박현수이비인후과의원 주소는 서울특별시 구로구 개봉로 9, (개봉동) 전화번호는 02-2688-2386 입니다."
912,서울 구로구 오류동,"병원명은 베일리이비인후과의원 주소는 서울특별시 구로구 오리로 1149, 랑데르 307호 (오류동) 전화번호는 02-2060-1525 입니다."
913,서울 구로구 개봉동,"병원명은 별소아청소년과의원 주소는 서울특별시 구로구 개봉로 71, 강서프라자 2층 (개봉동) 전화번호는 02-2066-1611 입니다."
914,서울 구로구 천왕동,"병원명은 삼성키즈소아청소년과의원 주소는 서울특별시 구로구 천왕로 106, 골드프라자 303호 (천왕동) 전화번호는 정보없음 입니다."
915,서울 구로구 구로동,"병원명은 삼성편한내과의원 주소는 서울특별시 구로구 디지털로32길 79, 조영빌딩 4층 (구로동) 전화번호는 02-853-8275 입니다."
916,서울 구로구 구로동,"병원명은 상쾌한이비인후과의원 주소는 서울특별시 구로구 도림로 67, 3층 (구로동) 전화번호는 02-865-5050 입니다."
917,서울 구로구 구로동,"병원명은 서울WE좋은내과의원 주소는 서울특별시 구로구 시흥대로 551, 광희빌딩 3층 (구로동) 전화번호는 02-3281-8787 입니다."
918,서울 구로구 구로동,"병원명은 서울내과의원 주소는 서울특별시 구로구 가마산로 268, 대림역와이즈플레이스 2층 (구로동) 전화번호는 02-830-8388 입니다."
919,서울 구로구 개봉동,"병원명은 서울바른마취통증의학과의원 주소는 서울특별시 구로구 경인로 319, 대림프라자 2,3층 201,301~2,305~7호 (개봉동) 전화번호는 02-2135-5547 입니다."
920,서울 구로구 개봉동,"병원명은 서울오케이내과의원 주소는 서울특별시 구로구 개봉로 66, 3층 (개봉동) 전화번호는 02-6956-7588 입니다."
921,서울 구로구 오류동,"병원명은 성모나은내과의원 주소는 서울특별시 구로구 경인로 204, 301호 (오류동) 전화번호는 02-6952-0122 입니다."
922,서울 구로구 개봉동,"병원명은 성신가정의학과의원 주소는 서울특별시 구로구 개봉로3길 35, 성은빌딩 2층 (개봉동) 전화번호는 정보없음 입니다."
923,서울 구로구 궁동,"병원명은 성재의원 주소는 서울특별시 구로구 오리로 1268, 유림빌딩 1~2층 (궁동) 전화번호는 02-2625-7533 입니다."
924,서울 구로구 구로동,"병원명은 세진내과의원 주소는 서울특별시 구로구 구로중앙로 68, 4층 (구로동, 신안타워) 전화번호는 02-851-4587 입니다."
925,서울 구로구 오류동,"병원명은 소생한의원 주소는 서울특별시 구로구 경인로20가길 5, (오류동) 전화번호는 02-2684-3375 입니다."
926,서울 구로구 오류동,"병원명은 송기산내과의원 주소는 서울특별시 구로구 오류로8길 26, (오류동) 전화번호는 02-2617-7538 입니다."
927,서울 구로구 구로동,"병원명은 송소아과의원 주소는 서울특별시 구로구 구일로4길 46, 201호 (구로동, 현대연예인아파트) 전화번호는 02-867-7519 입니다."
928,서울 구로구 구로동,"병원명은 신도림하나이비인후과의원 주소는 서울특별시 구로구 새말로 89, 태영빌딩 202,501호 (구로동) 전화번호는 02-859-5011 입니다."
929,서울 구로구 개봉동,"병원명은 아이맘소아청소년과의원 주소는 서울특별시 구로구 남부순환로97길 3, KS프리미어빌딩 602호 (개봉동) 전화번호는 정보없음 입니다."
930,서울 구로구 신도림동,"병원명은 아이온소아청소년과의원 주소는 서울특별시 구로구 경인로 661, 신도림1차푸르지오 211,212호 (신도림동) 전화번호는 02-3439-7588 입니다."
931,서울 구로구 구로동,"병원명은 애경내과의원 주소는 서울특별시 구로구 새말로 89, 4층 (구로동) 전화번호는 02-851-2111 입니다."
932,서울 구로구 신도림동,"병원명은 애경연세소아청소년과의원 주소는 서울특별시 구로구 경인로67길 23, 301호 (신도림동, 신도림2차푸르지오) 전화번호는 정보없음 입니다."
933,서울 구로구 오류동,"병원명은 양정안소아청소년과의원 주소는 서울특별시 구로구 경인로20길 6, 포스시티 105,106호 (오류동) 전화번호는 02-2625-3200 입니다."
