,Q,A
2112,서울 송파구 문정동,"병원명은 샘이비인후과의원 주소는 서울특별시 송파구 법원로 114, c층 219호 (문정동, 엠스테이트빌딩 ) 전화번호는 02-2283-1305 입니다."
2113,서울 송파구 신천동,"병원명은 서울드림이비인후과의원 주소는 서울특별시 송파구 송파대로 570, 2층 (신천동, 타워730) 전화번호는 02-415-9430 입니다."
2114,서울 송파구 가락동,"병원명은 서울마취통증의학과의원 주소는 서울특별시 송파구 동남로 236, (가락동, 영빌딩 5층) 전화번호는 02-3431-5182 입니다."
2115,서울 송파구 오금동,"병원명은 서울메디칼의원 주소는 서울특별시 송파구 동남로 317, 3층 (오금동) 전화번호는 02-401-7005 입니다."
2116,서울 송파구 석촌동,"병원명은 서울박현경내과의원 주소는 서울특별시 송파구 가락로 111, 영보빌딩 2층 201호 (석촌동) 전화번호는 02-6952-0094 입니다."
2117,서울 송파구 송파동,"병원명은 서울삼성의원 주소는 서울특별시 송파구 가락로 214, 2층 201호 (송파동, 창우빌딩) 전화번호는 02-422-7227 입니다."
2118,서울 송파구 가락동,"병원명은 서울석병원 주소는 서울특별시 송파구 송이로 148, (가락동) 전화번호는 02-403-7585 입니다."
2119,서울 송파구 석촌동,"병원명은 서울수내과의원 주소는 서울특별시 송파구 송파대로 389, (석촌동, 2층) 전화번호는 02-414-9919 입니다."
2120,서울 송파구 방이동,"병원명은 서울아산탑내과의원 주소는 서울특별시 송파구 마천로 25, 민성빌딩 2층 (방이동) 전화번호는 02-412-5800 입니다."
2121,서울 송파구 마천동,"병원명은 서울이비인후과의원 주소는 서울특별시 송파구 거마로 62, 효명빌딩 4층 (마천동) 전화번호는 02-409-5227 입니다."
2122,서울 송파구 석촌동,"병원명은 서울큐재활의학과의원 주소는 서울특별시 송파구 송파대로 391, 2층,3층 (석촌동) 전화번호는 정보없음 입니다."
2123,서울 송파구 송파동,"병원명은 서재곤링커병원 주소는 서울특별시 송파구 백제고분로 436, (송파동, 서재곤링커병원) 전화번호는 1522-7113 입니다."
2124,서울 송파구 잠실동,"병원명은 서종내과의원 주소는 서울특별시 송파구 백제고분로 168, (잠실동, 2층) 전화번호는 02-419-7579 입니다."
2125,서울 송파구 석촌동,"병원명은 성림내과의원 주소는 서울특별시 송파구 백제고분로 276, (석촌동, 공익빌딩 203호) 전화번호는 02-420-3308 입니다."
2126,서울 송파구 가락동,"병원명은 성모사랑이비인후과의원 주소는 서울특별시 송파구 송파대로 345, 1A동 2049호 (가락동, 헬리오시티) 전화번호는 02-400-5580 입니다."
2127,서울 송파구 송파동,"병원명은 성모자애의원 주소는 서울특별시 송파구 가락로 158, (송파동) 전화번호는 02-419-3464 입니다."
2128,서울 송파구 거여동,"병원명은 성모행복정신건강의학과의원 주소는 서울특별시 송파구 양산로 42, 성보빌딩 3층 (거여동) 전화번호는 0507-1495-5777 입니다."
2129,서울 송파구 풍납동,"병원명은 성지의원 주소는 서울특별시 송파구 올림픽로 491, 2.5.6층 (풍납동, 세제빌딩) 전화번호는 02-471-1689 입니다."
2130,서울 송파구 방이동,"병원명은 세란소아청소년과의원 주소는 서울특별시 송파구 백제고분로48길 22, 2층 (방이동) 전화번호는 02-427-5975 입니다."
2131,서울 송파구 송파동,"병원명은 소소아과의원 주소는 서울특별시 송파구 백제고분로 381, 2층 (송파동, 우성빌딩) 전화번호는 02-416-1119 입니다."
2132,서울 송파구 오금동,"병원명은 속속내과의원 주소는 서울특별시 송파구 양재대로 1164, 홍일빌딩 6층 (오금동) 전화번호는 정보없음 입니다."
2133,서울 송파구 문정동,"병원명은 송파365의원 주소는 서울특별시 송파구 송파대로 111, 하비오길 111, 하비오길 202동 162~164호 (문정동, 파크하비오) 전화번호는 02-448-7582 입니다."
2134,서울 송파구 삼전동,"병원명은 송파GF의원 주소는 서울특별시 송파구 백제고분로 261, 202호 (삼전동) 전화번호는 02-413-9977 입니다."
2135,서울 송파구 송파동,"병원명은 송파가정의학과의원 주소는 서울특별시 송파구 오금로32길 28, (송파동, 수정빌딩 201호) 전화번호는 02-417-6165 입니다."
2136,서울 송파구 가락동,"병원명은 송파고려신경외과의원 주소는 서울특별시 송파구 오금로 410, (가락동, 2층) 전화번호는 02-400-2286 입니다."
2137,서울 송파구 마천동,"병원명은 송파민이비인후과의원 주소는 서울특별시 송파구 거마로 61, 301호 (마천동) 전화번호는 02-406-5075 입니다."
2138,서울 송파구 석촌동,"병원명은 송파바른정형외과의원 주소는 서울특별시 송파구 가락로 78, 3층 302~304호 (석촌동) 전화번호는 0507-1385-5502 입니다."
2139,서울 송파구 삼전동,"병원명은 송파바울의원 주소는 서울특별시 송파구 백제고분로 203, (삼전동, 2층) 전화번호는 02-425-3096 입니다."
2140,서울 송파구 문정동,"병원명은 송파베스트내과의원 주소는 서울특별시 송파구 법원로 128, 문정에스케이브이원지엘메트로시티 C동 2층 208~210호 (문정동) 전화번호는 02-6213-5200 입니다."
2141,서울 송파구 석촌동,"병원명은 송파본내과의원 주소는 서울특별시 송파구 송파대로 385, 성룡빌딩 지하1~지상1층 (석촌동) 전화번호는 02-423-6655 입니다."
2142,서울 송파구 방이동,"병원명은 송파서울이비인후과의원 주소는 서울특별시 송파구 오금로 91, (방이동, 태원빌딩 2층) 전화번호는 02-420-8264 입니다."
2143,서울 송파구 문정동,"병원명은 송파성모내과의원 주소는 서울특별시 송파구 법원로 114, 엠스테이트 C동 2층 203,220,221호 (문정동) 전화번호는 02-6080-1721 입니다."
2144,서울 송파구 방이동,"병원명은 송파성모이비인후과의원 주소는 서울특별시 송파구 마천로 41, 수기빌딩 3층 (방이동) 전화번호는 02-420-4700 입니다."
2145,서울 송파구 가락동,"병원명은 송파우리들의원 주소는 서울특별시 송파구 송파대로 345, 2037호,2038호 (가락동, 헬리오시티) 전화번호는 02-448-8275 입니다."
2146,서울 송파구 가락동,"병원명은 송파윌내과의원 주소는 서울특별시 송파구 오금로 404, (가락동, 303호) 전화번호는 02-406-3611 입니다."
2147,서울 송파구 석촌동,"병원명은 송파제일정형외과의원 주소는 서울특별시 송파구 가락로 99, (석촌동, 석촌프라자 2층) 전화번호는 02-423-1190 입니다."
2148,서울 송파구 장지동,"병원명은 송파파인의원 주소는 서울특별시 송파구 충민로 181, 로체프라자 211~233, 306~314호 (장지동) 전화번호는 02-449-2224 입니다."
2149,서울 송파구 문정동,"병원명은 수이비인후과의원 주소는 서울특별시 송파구 새말로 126, 1층 (문정동) 전화번호는 02-402-0133 입니다."
2150,서울 송파구 석촌동,"병원명은 스타이비인후과의원 주소는 서울특별시 송파구 백제고분로 365, 7층 (석촌동) 전화번호는 02-415-3335 입니다."
2151,서울 송파구 장지동,"병원명은 스타키즈소아청소년과의원 주소는 서울특별시 송파구 위례광장로 136, D동 201호 (장지동, 위례아이파크) 전화번호는 02-431-3751 입니다."
2152,서울 송파구 신천동,"병원명은 시그마마취통증의학과의원 주소는 서울특별시 송파구 올림픽로 289, 잠실시그마타워 3층 311~313호 (신천동) 전화번호는 0507-1326-5590 입니다."
2153,서울 송파구 송파동,"병원명은 시온정형외과의원 주소는 서울특별시 송파구 가락로 166, 3층 (송파동) 전화번호는 02-415-7110 입니다."
2154,서울 송파구 방이동,"병원명은 신원웅한의원 주소는 서울특별시 송파구 양재대로 1222, 올림픽프라자 316,345호 (방이동) 전화번호는 02-404-8884 입니다."
2155,서울 송파구 잠실동,"병원명은 신천상쾌한이비인후과의원 주소는 서울특별시 송파구 올림픽로 119, 잠실파인애플상가 3층 3B04호 (잠실동) 전화번호는 02-422-7112 입니다."
2156,서울 송파구 풍납동,"병원명은 아산사랑의원 주소는 서울특별시 송파구 풍성로 52, 상가동 1층 16,17호 (풍납동, 대아아파트) 전화번호는 02-485-8508 입니다."
2157,서울 송파구 오금동,"병원명은 아산우리내과의원 주소는 서울특별시 송파구 마천로 190, 청전빌딩 3층 (오금동) 전화번호는 정보없음 입니다."
2158,서울 송파구 거여동,"병원명은 아산현소아청소년과의원 주소는 서울특별시 송파구 양산로 12, (거여동, 거여세신훼미리타운) 전화번호는 02-406-0407 입니다."
2159,서울 송파구 신천동,"병원명은 아이엠유의원 주소는 서울특별시 송파구 잠실로 156, 잠실광역환승센터 103호 (신천동) 전화번호는 02-417-0500 입니다."
2160,서울 송파구 신천동,"병원명은 아이웰소아청소년과의원 주소는 서울특별시 송파구 올림픽로 435, (신천동, 파크리오상가B동 308호) 전화번호는 02-416-5234 입니다."
2161,서울 송파구 잠실동,"병원명은 양의원 주소는 서울특별시 송파구 올림픽로4길 40, 3층 33호 (잠실동, 우성아파트비상가) 전화번호는 02-413-0019 입니다."
2162,서울 송파구 풍납동,"병원명은 엄순길이비인후과의원 주소는 서울특별시 송파구 토성로 78, (풍납동, 201호) 전화번호는 02-488-7665 입니다."
2163,서울 송파구 잠실동,"병원명은 에코이비인후과의원 주소는 서울특별시 송파구 석촌호수로 133, B동 301,302호 (잠실동, 레이크팰리스) 전화번호는 02-423-1077 입니다."
2164,서울 송파구 석촌동,"병원명은 연산부인과의원 주소는 서울특별시 송파구 송파대로 381, (석촌동, 4층) 전화번호는 0507-1427-0333 입니다."
2165,서울 송파구 마천동,"병원명은 연세(유)소아청소년과의원 주소는 서울특별시 송파구 거마로 66, (마천동, 2층) 전화번호는 02-409-3482 입니다."
2166,서울 송파구 문정동,"병원명은 연세가정의학과의원 주소는 서울특별시 송파구 새말로 136, 201호 (문정동, 대명빌딩) 전화번호는 02-400-7450 입니다."
2167,서울 송파구 석촌동,"병원명은 연세건강증진내과의원 주소는 서울특별시 송파구 송파대로 371, 2층,3층,4층 (석촌동) 전화번호는 02-418-9999 입니다."
2168,서울 송파구 가락동,"병원명은 연세국민건강내과소아청소년과의원 주소는 서울특별시 송파구 중대로 105, 가락 ID TOWER 201~203, 301, 303호 (가락동) 전화번호는 02-6954-7525 입니다."
2169,서울 송파구 잠실동,"병원명은 연세라이프내과의원 주소는 서울특별시 송파구 올림픽로 114, 서경빌딩 4층 (잠실동) 전화번호는 02-6956-7579 입니다."
2170,서울 송파구 잠실동,"병원명은 연세리센츠산부인과의원 주소는 서울특별시 송파구 올림픽로 145, 리센츠 4층층 4B18,19호 (잠실동) 전화번호는 02-412-7788 입니다."
2171,서울 송파구 송파동,"병원명은 연세메디칼내과의원 주소는 서울특별시 송파구 가락로 166, (송파동, 2층) 전화번호는 02-423-6001 입니다."
2172,서울 송파구 가락동,"병원명은 연세바른정형외과의원 주소는 서울특별시 송파구 동남로 207, (가락동) 전화번호는 02-431-8877 입니다."
2173,서울 송파구 잠실동,"병원명은 연세봄이비인후과의원 주소는 서울특별시 송파구 올림픽로 119, (잠실동, 파인애플상가 5B29) 전화번호는 02-412-1175 입니다."
2174,서울 송파구 잠실동,"병원명은 연세새봄의원 주소는 서울특별시 송파구 올림픽로12길 34, B1, 1층 일부층 (잠실동) 전화번호는 02-2038-8909 입니다."
2175,서울 송파구 삼전동,"병원명은 연세송앤김내과의원 주소는 서울특별시 송파구 삼전로10길 11, 1~2층 103~105, 2층전체호 (삼전동) 전화번호는 02-425-3242 입니다."
2176,서울 송파구 삼전동,"병원명은 연세아이맘소아청소년과의원 주소는 서울특별시 송파구 석촌호수로 130, 신원빌딩 2층 (삼전동) 전화번호는 02-6956-0365 입니다."
2177,서울 송파구 문정동,"병원명은 연세우리내과의원 주소는 서울특별시 송파구 중대로 24, 406호 (문정동, 훼미리샤르망) 전화번호는 02-408-9461 입니다."
2178,서울 송파구 방이동,"병원명은 연세원의원 주소는 서울특별시 송파구 백제고분로 512, 로가디스빌딩 3층 (방이동) 전화번호는 02-419-7702 입니다."
2179,서울 송파구 가락동,"병원명은 연세윤이비인후과의원 주소는 서울특별시 송파구 동남로 209, (가락동, 2층) 전화번호는 정보없음 입니다."
2180,서울 송파구 가락동,"병원명은 연세이비인후과의원 주소는 서울특별시 송파구 오금로 412, (가락동, 2층) 전화번호는 02-3401-5050 입니다."
2181,서울 송파구 가락동,"병원명은 연세정소아과의원 주소는 서울특별시 송파구 동남로18길 9, 204호 (가락동, 극동아파트상가) 전화번호는 02-448-6436 입니다."
2182,서울 송파구 문정동,"병원명은 연세차내과의원 주소는 서울특별시 송파구 문정로4길 14, 2층 (문정동, 동산빌딩) 전화번호는 02-431-1257 입니다."
2183,서울 송파구 문정동,"병원명은 연세쿰내과의원 주소는 서울특별시 송파구 중대로 24, 207호 (문정동, 올림픽훼미리타운 아파트상가) 전화번호는 0507-1314-9422 입니다."
2184,서울 송파구 가락동,"병원명은 연세키즈소아과의원 주소는 서울특별시 송파구 오금로 404, (가락동, 원일빌딩 4층) 전화번호는 02-443-7078 입니다."
2185,서울 송파구 문정동,"병원명은 연세테라이비인후과의원 주소는 서울특별시 송파구 송파대로 167, B동 206호 (문정동, 문정역테라타워) 전화번호는 02-2054-3210 입니다."
2186,서울 송파구 가락동,"병원명은 연세헬리오소아청소년과의원 주소는 서울특별시 송파구 송파대로 345, 4층 4024호,4011호 (가락동, 헬리오시티) 전화번호는 0507-1489-3003 입니다."
2187,서울 송파구 가락동,"병원명은 연세후이비인후과의원 주소는 서울특별시 송파구 송파대로32길 15, 상가동 201~202호 (가락동, 가락금호아파트) 전화번호는 02-407-7498 입니다."
2188,서울 송파구 문정동,"병원명은 연세힐링이비인후과의원 주소는 서울특별시 송파구 법원로 114, C동 205호 (문정동, 엠스테이트) 전화번호는 02-2283-1172 입니다."
2189,서울 송파구 방이동,"병원명은 열린가정의학과의원 주소는 서울특별시 송파구 오금로11길 37, 301,302,303,304호 (방이동, 대명밸리온) 전화번호는 02-424-7533 입니다."
2190,서울 송파구 방이동,"병원명은 열린성모이비인후과의원 주소는 서울특별시 송파구 백제고분로 466, (방이동, 세나빌딩 2층) 전화번호는 02-6413-1004 입니다."
2191,서울 송파구 삼전동,"병원명은 영드림의원 주소는 서울특별시 송파구 백제고분로 262, 2층 (삼전동) 전화번호는 02-413-0037 입니다."
2192,서울 송파구 가락동,"병원명은 오기영내과의원 주소는 서울특별시 송파구 동남로18길 45, (가락동, 2층) 전화번호는 02-448-7245 입니다."
2193,서울 송파구 오금동,"병원명은 온가족소아청소년과의원 주소는 서울특별시 송파구 동남로29길 8-10, 퍼스트 스퀘어 301호 (오금동) 전화번호는 02-3401-7582 입니다."
2194,서울 송파구 석촌동,"병원명은 올림픽병원 주소는 서울특별시 송파구 백제고분로 283, 어깨동무빌딩 (석촌동) 전화번호는 02-1644-2119 입니다."
2195,서울 송파구 잠실동,"병원명은 와이비소아청소년과의원 주소는 서울특별시 송파구 올림픽로 145, (잠실동, 리센츠) 전화번호는 02-414-1238 입니다."
2196,서울 송파구 송파동,"병원명은 우리들내과의원 주소는 서울특별시 송파구 송파대로 380, (송파동, 4층) 전화번호는 02-414-2475 입니다."
2197,서울 송파구 방이동,"병원명은 우리이비인후과의원 주소는 서울특별시 송파구 양재대로 1222, 3층 29-1호 (방이동, 올림픽프라자상가 ) 전화번호는 02-404-2929 입니다."
2198,서울 송파구 장지동,"병원명은 위례별가정의학과의원 주소는 서울특별시 송파구 위례광장로 136, 상가5동 202,203,204호 (장지동, 위례아이파크) 전화번호는 02-443-8275 입니다."
2199,서울 송파구 장지동,"병원명은 위례선가정의학과의원 주소는 서울특별시 송파구 위례광장로 199, 성희프라자 4층 404~405호 (장지동) 전화번호는 02-431-8250 입니다."
2200,서울 송파구 장지동,"병원명은 위례소소아청소년과의원 주소는 서울특별시 송파구 위례광장로 193, 3층 304호 (장지동, 대길프라자) 전화번호는 02-403-1117 입니다."
2201,서울 송파구 장지동,"병원명은 위키소아청소년과의원 주소는 서울특별시 송파구 위례광장로 200, (장지동, 에스비트램스퀘어) 전화번호는 02-443-0075 입니다."
2202,서울 송파구 잠실동,"병원명은 윈가정의학과의원 주소는 서울특별시 송파구 올림픽로 106, (잠실동, 3층) 전화번호는 02-420-6540 입니다."
2203,서울 송파구 거여동,"병원명은 유이비인후과의원 주소는 서울특별시 송파구 거마로 4, 굿플란트빌딩 3층 (거여동) 전화번호는 02-431-4381 입니다."
2204,서울 송파구 방이동,"병원명은 윤명희소아과의원 주소는 서울특별시 송파구 양재대로 1222, (방이동, 올림픽선수촌상가 343호) 전화번호는 02-409-9800 입니다."
2205,서울 송파구 잠실동,"병원명은 은혜의원 주소는 서울특별시 송파구 올림픽로4길 48, 우성아파트 상가 3층 301호 (잠실동) 전화번호는 02-413-3196 입니다."
2206,서울 송파구 삼전동,"병원명은 은혜이비인후과의원 주소는 서울특별시 송파구 백제고분로 258, (삼전동, 2층) 전화번호는 02-417-1545 입니다."
2207,서울 송파구 문정동,"병원명은 의료법인일맥의료재단 송파인애가의원 주소는 서울특별시 송파구 문정로 65, 인애가한방병원 지하1층,3층,4층 (문정동) 전화번호는 02-443-7575 입니다."
2208,서울 송파구 가락동,"병원명은 이가정의학과의원 주소는 서울특별시 송파구 동남로 189, 506호 (가락동, 가락쌍용@26동 프라자상가 ) 전화번호는 02-407-1002 입니다."
2209,서울 송파구 송파동,"병원명은 이경이비인후과의원 주소는 서울특별시 송파구 송파대로 366, 2층 (송파동) 전화번호는 02-413-0069 입니다."
2210,서울 송파구 장지동,"병원명은 이루이비인후과의원 주소는 서울특별시 송파구 위례광장로 230, C동 201,202호 (장지동, 위례2차아이파크) 전화번호는 02-406-2500 입니다."
2211,서울 송파구 방이동,"병원명은 이석호내과의원 주소는 서울특별시 송파구 백제고분로 469, 2층 (방이동) 전화번호는 02-420-7582 입니다."
2212,서울 송파구 신천동,"병원명은 이종원내과의원 주소는 서울특별시 송파구 올림픽로 435, (신천동, 파크리오상가 315호) 전화번호는 02-418-3636 입니다."
2213,서울 송파구 마천동,"병원명은 이창훈내과의원 주소는 서울특별시 송파구 마천로51길 2, (마천동, 3층 4층) 전화번호는 02-406-7519 입니다."
2214,서울 송파구 가락동,"병원명은 이화내과의원 주소는 서울특별시 송파구 송파대로28길 27, (가락동, 성원상떼빌 102동 203호) 전화번호는 02-430-0447 입니다."
2215,서울 송파구 신천동,"병원명은 잠실메트로의원 주소는 서울특별시 송파구 올림픽로 305, 잠실역8호선 지하1층 102호 (신천동) 전화번호는 02-420-7824 입니다."
2216,서울 송파구 신천동,"병원명은 잠실서울이비인후과의원 주소는 서울특별시 송파구 올림픽로35길 112, 장미B상가 제2동 305호 (신천동) 전화번호는 02-415-2975 입니다."
2217,서울 송파구 신천동,"병원명은 잠실성모마취통증의학과의원 주소는 서울특별시 송파구 올림픽로37길 130, 파크리오 A상가 5층 502,503, 519호 (신천동) 전화번호는 0507-1405-0138 입니다."
2218,서울 송파구 신천동,"병원명은 잠실수가정의학과의원 주소는 서울특별시 송파구 올림픽로 289, 잠실시그마타워 305호 (신천동) 전화번호는 02-558-6484 입니다."
2219,서울 송파구 잠실동,"병원명은 잠실아산이비인후과의원 주소는 서울특별시 송파구 올림픽로 114, 서경빌딩 10층 일부호 (잠실동) 전화번호는 02-6952-7592 입니다."
2220,서울 송파구 문정동,"병원명은 잠실자생한방병원 주소는 서울특별시 송파구 충민로 66, 가든파이브라이프 10층 L-10001~4,L-10006~8호 (문정동) 전화번호는 1577-0007 입니다."
2221,서울 송파구 잠실동,"병원명은 잠실진단검사의학과의원 주소는 서울특별시 송파구 올림픽로 118, 302호 (잠실동, 청우빌딩) 전화번호는 02-416-2255 입니다."
2222,서울 송파구 풍납동,"병원명은 재단법인아산사회복지재단 서울아산병원 주소는 서울특별시 송파구 올림픽로43길 88, 서울아산병원 (풍납동) 전화번호는 02-3010-3131 입니다."
2223,서울 송파구 석촌동,"병원명은 전안과의원 주소는 서울특별시 송파구 가락로 113, (석촌동, 3층) 전화번호는 02-424-3518 입니다."
2224,서울 송파구 방이동,"병원명은 전준권내과의원 주소는 서울특별시 송파구 오금로31길 11, (방이동) 전화번호는 02-421-5553 입니다."
2225,서울 송파구 신천동,"병원명은 정담이비인후과의원 주소는 서울특별시 송파구 올림픽로35길 10, 상가B동 202호 (신천동, 파크리오) 전화번호는 02-420-5866 입니다."
2226,서울 송파구 잠실동,"병원명은 제트이비인후과의원 주소는 서울특별시 송파구 석촌호수로 61, 트리지움 상가 3층 (잠실동) 전화번호는 02-423-8275 입니다."
2227,서울 송파구 방이동,"병원명은 좋은내과의원 주소는 서울특별시 송파구 백제고분로48길 17, (방이동) 전화번호는 02-415-3919 입니다."
2228,서울 송파구 가락동,"병원명은 준앤민닥터포유의원 주소는 서울특별시 송파구 양재대로 932, 업무동 5층 8,9,10,10-2호 (가락동) 전화번호는 02-423-7575 입니다."
2229,서울 송파구 마천동,"병원명은 중앙내과의원 주소는 서울특별시 송파구 마천로57길 5, 마천빌딩 4층 (마천동) 전화번호는 02-408-3914 입니다."
2230,서울 송파구 문정동,"병원명은 지파이브(G5)연합의원 주소는 서울특별시 송파구 충민로 52, 가든파이브웍스 3층 S305,S306호 (문정동) 전화번호는 02-2047-1133 입니다."
2231,서울 송파구 가락동,"병원명은 참내과의원 주소는 서울특별시 송파구 동남로 141, 2층 (가락동, 옥산빌딩) 전화번호는 02-430-9168 입니다."
2232,서울 송파구 방이동,"병원명은 참외과 참소아청소년과의원 주소는 서울특별시 송파구 백제고분로 463, 302호303호 (방이동) 전화번호는 02-6952-0810 입니다."
2233,서울 송파구 잠실동,"병원명은 초록이비인후과의원 주소는 서울특별시 송파구 백제고분로 187, 3층 304호 (잠실동, 파크인수) 전화번호는 02-997-9988 입니다."
2234,서울 송파구 거여동,"병원명은 최은희소아과의원 주소는 서울특별시 송파구 오금로 512, (거여동, 2차쌍용APT상가 208호) 전화번호는 02-409-5577 입니다."
2235,서울 송파구 가락동,"병원명은 최혜진이비인후과의원 주소는 서울특별시 송파구 동남로 141, (가락동, 501호) 전화번호는 02-400-0744 입니다."
2236,서울 송파구 오금동,"병원명은 코모키이비인후과의원 주소는 서울특별시 송파구 마천로 53, (오금동, 3층) 전화번호는 02-443-5599 입니다."
2237,서울 송파구 가락동,"병원명은 코코아이비인후과의원 주소는 서울특별시 송파구 송파대로 345, 1A동 3층 3056호,3057호 (가락동, 헬리오시티) 전화번호는 02-430-2221 입니다."
2238,서울 송파구 거여동,"병원명은 코코이비인후과의원 주소는 서울특별시 송파구 양산로 42, 4층 (거여동) 전화번호는 02-449-5075 입니다."
2239,서울 송파구 신천동,"병원명은 키즈맘소아청소년과의원 주소는 서울특별시 송파구 올림픽로35길 10, 상가B동 2층 212호 (신천동, 파크리오) 전화번호는 02-416-7770 입니다."
